{
  "schemaVersion": 1,
  "clientId": "kimberly-james-bridal",
  "status": "draft",
  "authorizedRequesterRefs": ["registry-contact:kimberly-james-bridal:0", "user:dillon"],
  "allowedPlatforms": ["google_ads", "meta_ads"],
  "allowedTriggerClasses": ["campaign_launch", "campaign_expansion", "campaign_restart"],
  "allowedAccountRefs": ["access-broker:kimberly-james-bridal/google-ads-production", "access-broker:kimberly-james-bridal/meta-ads-production-1249689223687250"],
  "allowedLocationScopes": ["approved_market"],
  "allowedDeploymentEnvironments": ["staging", "production"],
  "permissions": { "buildLocalArtifacts": true, "deployLandingPage": false, "createPausedObjects": false, "enableCampaigns": false, "adjustBudget": false },
  "limits": { "currency": "USD", "maxDailyPerCampaign": null, "maxTotalPerRequest": null, "maxLocationsPerRequest": null },
  "requirements": { "validateOnlyFirst": true, "createPausedFirst": true, "trackingQa": true, "landingPageQa": true, "liveReadback": true, "rollbackPlan": true, "maxEvidenceAgeHours": 72 },
  "approvedBy": null,
  "approvedAt": null,
  "expiresAt": null,
  "approvalRef": null,
  "privacy": "redacted",
  "containsSecrets": false,
  "containsDirectIdentifiers": false,
  "containsRawCommunications": false
}
